{
  "id": "wall-sconce-cj-travertine-cone-walnut",
  "slot": "wall-sconce",
  "name": "Travertine Cone Shade Wall Sconce on walnut backplate with black arm, D15 cm (E27)",
  "category": "wall-sconce",
  "rooms": [
    "living-room"
  ],
  "placement": "wall",
  "supplier": {
    "name": "CJ Dropshipping",
    "product_url": "https://cjdropshipping.com/product/-p-2507030557521607600.html",
    "sku": "CJYD2419188",
    "rating": null
  },
  "price": {
    "cost": 17.08,
    "currency": "USD",
    "suggested_retail": null
  },
  "shipping": {
    "days_min": 12,
    "days_max": 50,
    "ships_to": [
      "IL"
    ]
  },
  "dimensions_cm": {
    "width": 15,
    "depth": null,
    "height": 15
  },
  "colors": {
    "dominant_hex": "#E2D3BE",
    "secondary_hex": [
      "#7A4A33",
      "#2B2A2A"
    ],
    "temperature": "warm"
  },
  "materials": [
    "travertine/'yellow cave stone' cone shade",
    "solid wood backplate (walnut tone)",
    "black metal arm",
    "E27 lamp holder"
  ],
  "texture": "light honed travertine cone, round dark-walnut wall plate, short black horizontal arm - a classic small reading sconce",
  "finish": "matte",
  "visual_weight": "light",
  "lighting": {
    "color_temp_k": null,
    "light_type": "direct"
  },
  "images": {
    "urls": [
      "https://cf.cjdropshipping.com/quick/product/73416f68-3d04-4398-84e0-d4ccd0951995.jpg",
      "https://cf.cjdropshipping.com/quick/product/3b46ce66-eec5-4fd8-b179-08896fe36a5e.jpg",
      "https://oss-cf.cjdropshipping.com/product/2025/12/18/08/ba69e790-8c7f-4d26-adc7-45ab1b6dc657.jpg",
      "https://oss-cf.cjdropshipping.com/product/2025/12/18/08/82ca46f6-7f38-4189-a04b-f7cf21dc21b7_trans.jpeg",
      "https://cf.cjdropshipping.com/quick/product/ab1e0d42-41a3-419c-a781-1108309425b4.jpg",
      "https://cf.cjdropshipping.com/quick/product/fe407dce-dd36-48e4-9036-39d11c98c568.jpg",
      "https://oss-cf.cjdropshipping.com/product/2025/12/18/08/dec3a505-00e1-403a-a426-e8549a064671.jpg",
      "https://oss-cf.cjdropshipping.com/product/2025/12/18/08/9f819d5f-7a3f-4741-86da-6a5f43e81c1b_trans.jpeg",
      "https://cf.cjdropshipping.com/quick/product/c73c34a1-ce65-475c-933c-3d285d1c29e9.jpg"
    ],
    "quality": "high",
    "usage_rights": "unclear"
  },
  "options": {
      "axes": [
        {"id": "size", "name_he": "מידה", "values": [
          {"id": "15", "label_he": "קוטר 15 ס\"מ", "label_src": "Diameter 15CM"},
          {"id": "15-2", "label_he": "15 ס\"מ", "label_src": "15CM"}
        ]},
        {"id": "other", "name_he": "אפשרות", "values": [
          {"id": "no-light-source", "label_he": "בלי נורה", "label_src": "No Light Source"},
          {"id": "warm-light-110to240v", "label_he": "אור חם", "label_src": "Warm Light 110to240V"},
          {"id": "white-light-110to240v", "label_he": "White Light 110to240V"},
          {"id": "tricolor-light-110to240v", "label_he": "Tricolor Light 110to240V"}
        ]}
      ],
      "skus": [
        {"id": "CJYD241918801AZ", "values": {"size": "15", "other": "no-light-source"}, "price": {"amount": 16.58, "currency": "USD"}, "image": "https://cf.cjdropshipping.com/quick/product/3b46ce66-eec5-4fd8-b179-08896fe36a5e.jpg", "in_room": false},
        {"id": "CJYD241918802BY", "values": {"size": "15", "other": "warm-light-110to240v"}, "price": {"amount": 17.08, "currency": "USD"}, "shipping_il": {"amount": 29.57, "currency": "USD", "days": "12-50"}, "image": "https://cf.cjdropshipping.com/quick/product/3b46ce66-eec5-4fd8-b179-08896fe36a5e.jpg", "in_room": true},
        {"id": "CJYD241918803CX", "values": {"size": "15", "other": "white-light-110to240v"}, "price": {"amount": 17.08, "currency": "USD"}, "image": "https://cf.cjdropshipping.com/quick/product/3b46ce66-eec5-4fd8-b179-08896fe36a5e.jpg", "in_room": false},
        {"id": "CJYD241918804DW", "values": {"size": "15", "other": "tricolor-light-110to240v"}, "price": {"amount": 17.08, "currency": "USD"}, "image": "https://cf.cjdropshipping.com/quick/product/3b46ce66-eec5-4fd8-b179-08896fe36a5e.jpg", "in_room": false},
        {"id": "CJYD241918807GT", "values": {"size": "15-2", "other": "warm-light-110to240v"}, "price": {"amount": 19.07, "currency": "USD"}, "image": "https://oss-cf.cjdropshipping.com/product/2025/12/18/08/82ca46f6-7f38-4189-a04b-f7cf21dc21b7_trans.jpeg", "in_room": false},
        {"id": "CJYD241918806FU", "values": {"size": "15-2", "other": "tricolor-light-110to240v"}, "price": {"amount": 20.73, "currency": "USD"}, "image": "https://oss-cf.cjdropshipping.com/product/2025/12/18/08/9f819d5f-7a3f-4741-86da-6a5f43e81c1b_trans.jpeg", "in_room": false}
      ],
      "default_sku": "CJYD241918802BY",
      "source": "api"
    },
  "style_scores": {
    "nordic": { "score": 6.0, "reason": "master-designer 2026-10-11: קונוס טרוורטין יפה עם אור למטה, אבל זרוע שחורה קצרה ולוחית אגוז אדמדמה (מחוץ לאלון); לזוג הטרוורטין אסורה זרוע, ולמנורת הקריאה חסרים אהיל בד ובליטה של 30–45." }
  },
  "status": "candidate",
  "notes": "TRAVERTINE SCONCE with a downward cone (best for a reading spot). Listing gives shade diameter 15 cm (projection not stated; from photos ~18-20 cm - NOT verified). Recommended vid 2507030557521608500 'Warm Light 110to240V-Diameter 15CM' $17.08 (sku CJYD241918802BY); 'No Light Source' 2507030557521608100 $16.58; newer variants 2512180805031628600 'Warm Light 110to240V-15CM' $19.07 (photos of a different, bell-shaped dolomite shade on a wood plate, H15 x W11 cm, E27 5W). ELECTRICAL: variant names say 110-240V (covers 220-240V) while the spec line says '<=36V' (likely LED); plug: none shown - hardwired; CE: not verified. SHIPPING to IL (vid ...608500): cheapest CJPacket Eub 12-50 d $29.57; fast reasonable CJPacket To Door 11-18 d $49.04 (Sensitive $44.41; DHL $201.82). listedNum 6. RISKS: walnut plate is red-brown (Bible: oak or black) - may clash; two different shade designs mixed in one listing. SPEC CHECK vs search-specs-2026-10-04: FAILS 'no arm' (short black arm) and walnut plate; cone W15 (+1), H15 OK; downlight only; E27 allows a 2700K bulb; CE missing. INSTALL: hardwired to a wall junction box, no visible cable - requires installation by an electrician (user decision 2026-10-04)."
}
