{
  "id": "throw-cj-cotton-linen-light-gray-200x230",
  "slot": "throw",
  "name": "Nap Single/Double Air-conditioning Quilt Cotton-linen Throw Blanket, Light Gray 200x230cm",
  "category": "throw",
  "rooms": [
    "master",
    "living-room",
    "kids"
  ],
  "placement": "surface",
  "supplier": {
    "name": "CJ Dropshipping",
    "product_url": "https://cjdropshipping.com/product/-p-2603250230561606300.html",
    "sku": "CJYD280287002BY",
    "rating": null
  },
  "price": {
    "cost": 17.41,
    "currency": "USD",
    "suggested_retail": null
  },
  "shipping": {
    "days_min": 12,
    "days_max": 50,
    "ships_to": [
      "IL"
    ]
  },
  "dimensions_cm": {
    "width": 200,
    "depth": 230,
    "height": null
  },
  "colors": {
    "dominant_hex": "#DAD5CC",
    "secondary_hex": [],
    "temperature": "neutral"
  },
  "materials": [
    "Main Fabric Composition: 92.5% Cotton + 7.5% Linen",
    "Cloth (listing material field)"
  ],
  "texture": "solid-colour towel-blanket weave with a soft slubby surface and fine fringe-free hem",
  "finish": "matte",
  "visual_weight": "medium",
  "images": {
    "urls": [
      "https://cf.cjdropshipping.com/quick/product/e3c86db6-03cb-4ce0-968c-07c3bfa7aa12.jpg",
      "https://cf.cjdropshipping.com/quick/product/2d580440-9920-47fb-95a7-9aeda62fbdd5.jpg",
      "https://cf.cjdropshipping.com/quick/product/25d7f461-9099-48b8-bdf7-1a54f41b3bad.jpg",
      "https://cf.cjdropshipping.com/quick/product/290a7084-d4c0-4f55-a681-210b94634b97.jpg"
    ],
    "quality": "medium",
    "usage_rights": "unclear"
  },
  "options": {
      "axes": [
        {"id": "color", "name_he": "צבע", "values": [
          {"id": "light-gray", "label_he": "אפור בהיר", "label_src": "Light Gray", "hex": "#BDBDBB"},
          {"id": "light-green", "label_he": "ירוק בהיר", "label_src": "Light Green", "hex": "#96AA94"},
          {"id": "dark-gray", "label_he": "אפור כהה", "label_src": "Dark Gray", "hex": "#646462"},
          {"id": "dark-green", "label_he": "ירוק כהה", "label_src": "Dark Green", "hex": "#2F4A35"},
          {"id": "brown", "label_he": "חום", "label_src": "Brown", "hex": "#7A5A40"}
        ]},
        {"id": "size", "name_he": "מידה", "values": [
          {"id": "150x200", "label_he": "150×200 ס\"מ", "label_src": "150x200cm"},
          {"id": "200x230", "label_he": "200×230 ס\"מ", "label_src": "200x230cm"}
        ]}
      ],
      "skus": [
        {"id": "CJYD280287001AZ", "values": {"color": "light-gray", "size": "150x200"}, "price": {"amount": 12.94, "currency": "USD"}, "image": "https://cf.cjdropshipping.com/quick/product/e3c86db6-03cb-4ce0-968c-07c3bfa7aa12.jpg", "in_room": false},
        {"id": "CJYD280287002BY", "values": {"color": "light-gray", "size": "200x230"}, "price": {"amount": 17.41, "currency": "USD"}, "image": "https://cf.cjdropshipping.com/quick/product/e3c86db6-03cb-4ce0-968c-07c3bfa7aa12.jpg", "in_room": true},
        {"id": "CJYD280287003CX", "values": {"color": "light-green", "size": "150x200"}, "price": {"amount": 12.94, "currency": "USD"}, "image": "https://cf.cjdropshipping.com/quick/product/ac5c6dc2-b9d2-49ce-b159-0381f4388478.jpg", "in_room": false},
        {"id": "CJYD280287004DW", "values": {"color": "light-green", "size": "200x230"}, "price": {"amount": 17.41, "currency": "USD"}, "image": "https://cf.cjdropshipping.com/quick/product/ac5c6dc2-b9d2-49ce-b159-0381f4388478.jpg", "in_room": false},
        {"id": "CJYD280287005EV", "values": {"color": "dark-gray", "size": "150x200"}, "price": {"amount": 12.94, "currency": "USD"}, "image": "https://cf.cjdropshipping.com/quick/product/e74782db-3c7a-435f-afec-9c919320686d.jpg", "in_room": false},
        {"id": "CJYD280287006FU", "values": {"color": "dark-gray", "size": "200x230"}, "price": {"amount": 17.41, "currency": "USD"}, "image": "https://cf.cjdropshipping.com/quick/product/e74782db-3c7a-435f-afec-9c919320686d.jpg", "in_room": false},
        {"id": "CJYD280287007GT", "values": {"color": "dark-green", "size": "150x200"}, "price": {"amount": 12.94, "currency": "USD"}, "image": "https://cf.cjdropshipping.com/quick/product/290a7084-d4c0-4f55-a681-210b94634b97.jpg", "in_room": false},
        {"id": "CJYD280287008HS", "values": {"color": "dark-green", "size": "200x230"}, "price": {"amount": 17.41, "currency": "USD"}, "image": "https://cf.cjdropshipping.com/quick/product/290a7084-d4c0-4f55-a681-210b94634b97.jpg", "in_room": false},
        {"id": "CJYD280287009IR", "values": {"color": "brown", "size": "150x200"}, "price": {"amount": 12.94, "currency": "USD"}, "image": "https://cf.cjdropshipping.com/quick/product/ff79f710-fc32-4401-826d-16fba452d669.jpg", "in_room": false},
        {"id": "CJYD280287010JQ", "values": {"color": "brown", "size": "200x230"}, "price": {"amount": 17.41, "currency": "USD"}, "image": "https://cf.cjdropshipping.com/quick/product/ff79f710-fc32-4401-826d-16fba452d669.jpg", "in_room": false}
      ],
      "default_sku": "CJYD280287002BY",
      "source": "api"
    },
  "status": "candidate",
  "notes": "pid 2603250230561606300, recommended vid 2603250230561606900 ('Light Gray 200x230cm'), $17.41 — price per piece. Alternatives: Light Green 200x230 vid 2603250230561607500 $17.41 (sage-like; check against muted sage #A7B09A); 150x200 sizes $12.94 (too narrow for a 180–185 fold). Dark Gray / Dark Green / Brown not for Nordic base. Verbatim: 'Pattern: Solid Color'; 'Main Fabric Composition: 92.5% Cotton + 7.5% Linen'; 'Bedding Subcategory: Towel Blanket'; 'Dimensions: 150*200 cm (approx. 1.300 kg), 200*230 cm (approx. 1.800 kg)'; 'Printing and Dyeing Process: Reactive Dyeing'; 'Style: Modern Minimalist'. SPEC CHECK master/throw (folded_w 180–185, folded_d 35–45): 200×230 folded lengthwise in five gives ~200×46 — or folded to 185 wide with a tuck; designer to decide. 150×200 does not reach 180. Colour from photo ~#DAD5CC (mist grey, in range). Mostly cotton, so it reads as cotton waffle/towel rather than linen. SHIPPING to IL (freight API, qty 1, 2026-10-09): CJPacket Eub 12–50 d $27.05; Sensitive $40.44; Liquid Line $41.60; To Door 11–18 d $45.07; DHL $185.97. listedNum 5. Lifestyle photos are one consistent studio set (same bedroom, 5 colours)."
}
