{
  "id": "gallery-art-cj-black-botanical-cutout-set3",
  "slot": "gallery-art",
  "name": "Simple Nordic Morandi Plant Flower Wall Art, set of 3 - Type B (black botanical cut-out silhouettes on cream, oak-look frames)",
  "category": "framed-art",
  "rooms": [
    "corridor",
    "dining",
    "work"
  ],
  "placement": "wall",
  "supplier": {
    "name": "CJ Dropshipping",
    "product_url": "https://cjdropshipping.com/product/-p-2511220828321604600.html",
    "sku": "CJJT2613578",
    "rating": null
  },
  "price": {
    "cost": 14.53,
    "currency": "USD",
    "suggested_retail": null
  },
  "shipping": {
    "days_min": null,
    "days_max": null,
    "ships_to": [
      "IL"
    ]
  },
  "dimensions_cm": {
    "width": 40,
    "depth": 2.5,
    "height": 60
  },
  "colors": {
    "dominant_hex": "#EFE6D6",
    "secondary_hex": [
      "#2C2C2C",
      "#B98E5E"
    ],
    "temperature": "warm"
  },
  "materials": [
    "canvas print",
    "PS (polystyrene) frame, oak-look"
  ],
  "texture": "flat matte print: charcoal-black leafy flower silhouettes filling a cream field; slim warm-wood-look frame 2.5 deep",
  "finish": "matte",
  "visual_weight": "medium",
  "lighting": null,
  "images": {
    "urls": [
      "https://cf.cjdropshipping.com/quick/product/48135295-96c3-49cf-9e9b-a8dc5972c7d9.jpg",
      "https://cf.cjdropshipping.com/quick/product/2685afe5-6908-4d88-8c17-7cbc9c0fc90f.jpg",
      "https://oss-cf.cjdropshipping.com/product/2025/11/22/08/f5f1429c-0941-461a-93f6-19da4e2ab26e_trans.jpeg",
      "https://cf.cjdropshipping.com/quick/product/0a3c5ac6-0389-4743-bdf0-910b84594f8b.jpg",
      "https://cf.cjdropshipping.com/quick/product/84b59ea6-677d-4954-bdf2-9ebb5bad6663.jpg"
    ],
    "quality": "medium",
    "usage_rights": "unclear"
  },
  "options": {
      "axes": [
        {"id": "style", "name_he": "דגם", "values": [
          {"id": "type-a", "label_he": "Type A"},
          {"id": "type-b", "label_he": "Type B"},
          {"id": "type-c", "label_he": "Type C"}
        ]},
        {"id": "size", "name_he": "מידה", "values": [
          {"id": "30x40", "label_he": "30×40 ס\"מ", "label_src": "30X40cm"},
          {"id": "40x60", "label_he": "40×60 ס\"מ", "label_src": "40X60cm"}
        ]}
      ],
      "skus": [
        {"id": "CJJT261357801AZ", "values": {"style": "type-a", "size": "30x40"}, "price": {"amount": 12.74, "currency": "USD"}, "image": "https://cf.cjdropshipping.com/quick/product/48135295-96c3-49cf-9e9b-a8dc5972c7d9.jpg", "in_room": false},
        {"id": "CJJT261357802BY", "values": {"style": "type-a", "size": "40x60"}, "price": {"amount": 14.53, "currency": "USD"}, "image": "https://cf.cjdropshipping.com/quick/product/48135295-96c3-49cf-9e9b-a8dc5972c7d9.jpg", "in_room": false},
        {"id": "CJJT261357803CX", "values": {"style": "type-b", "size": "30x40"}, "price": {"amount": 12.74, "currency": "USD"}, "image": "https://cf.cjdropshipping.com/quick/product/1fa4e06f-3eac-40f9-ad62-e2700ba73b62.jpg", "in_room": false},
        {"id": "CJJT261357804DW", "values": {"style": "type-b", "size": "40x60"}, "price": {"amount": 14.53, "currency": "USD"}, "shipping_il": {"amount": 10.65, "currency": "USD", "days": "12-50"}, "image": "https://cf.cjdropshipping.com/quick/product/1fa4e06f-3eac-40f9-ad62-e2700ba73b62.jpg", "in_room": true},
        {"id": "CJJT261357805EV", "values": {"style": "type-c", "size": "30x40"}, "price": {"amount": 12.74, "currency": "USD"}, "image": "https://cf.cjdropshipping.com/quick/product/2685afe5-6908-4d88-8c17-7cbc9c0fc90f.jpg", "in_room": false},
        {"id": "CJJT261357806FU", "values": {"style": "type-c", "size": "40x60"}, "price": {"amount": 14.53, "currency": "USD"}, "image": "https://cf.cjdropshipping.com/quick/product/2685afe5-6908-4d88-8c17-7cbc9c0fc90f.jpg", "in_room": false}
      ],
      "default_sku": "CJJT261357804DW",
      "source": "api"
    },
  "status": "candidate",
  "notes": "Recommended vid 2511220828321605200 ('Type B 40X60cm', set of 3, $14.53, 550 g). Smaller: Type B 30X40 vid 2511220828321605000 ($12.74). Types A (pink/orange flowers) and C (blue botanical) are outside the palette - do not use. Description: 'Set B 3 pieces/set', 'PS frame + canvas', framed; frame depth 2.5 (image). SHIPPING to IL: NOT quoted (API quota) - quote before selection (550 g, carton 42x62x5). listedNum 17. SPEC CHECK (corridor gallery-art: 3 prints 40 wide, gaps 20, centre Z 1.45, top <= 1.70 => height <= 50; charcoal carrier): 40 wide PASS; 60 high FAILS the top line (centre 1.45 -> top 1.75, 5 cm over) - either lower the centre to 1.40 (master-designer) or use 30x40 (then 30 wide, -10); charcoal motif PASS; cream ground PASS. RISKS: frame is plastic (PS) with a wood look - the Bible forbids printed-wood-look MDF; close-up may read fake; Matisse-like cut-out flowers are a broad genre, not a copy of one named work (master-designer to confirm); no mat. SAME LISTING also carded in parallel (same day) by another sourcing agent for another room: data/products/kids/framed-prints/framed-prints-cj-flower-cutout-set-30x40.json (kids, 30x40) - one product, several rooms; freight/CE data apply to both."
}
